{
  "$schema": "https://json-schema.org/draft/2020-12/schema",
  "$id": "https://github.com/woliveiras/storehouse/catalog/skills.schema.json",
  "title": "Storehouse provenance inventory",
  "type": "object",
  "required": ["schema_version", "source", "tuxedo_exclusion_source", "skills"],
  "properties": {
    "schema_version": { "const": 2 },
    "source": { "type": "object" },
    "tuxedo_exclusion_source": { "type": "object" },
    "skills": { "type": "array", "minItems": 34, "maxItems": 34 }
  }
}
