{
  "schema_version": 2,
  "source": {
    "repository": "woliveiras/geremmyas",
    "commit": "783ac878213b61acb914b9151c779c6de0b84286",
    "skills_tree_listing_sha256": "7de30d71108e8c4e73641a70aaa2d9541ce97f6b826cca528f6eeed0bb73e20d",
    "license": "MIT",
    "license_sha256": "24923e703cfafa4e2c5098f4d5b0442ab43f9405dbdbb9fd961707c32e5e4702",
    "license_scope": "Geremmyas repository files at the frozen source commit; no skill-local exception was found."
  },
  "tuxedo_exclusion_source": {
    "repository": "woliveiras/tuxedo",
    "commit": "168922a54b695fd2446295c58157981079d2d5d6",
    "skills_tree_listing_sha256": "3ed55c2bcd4614cd7074a6ff4ff01199a81b4dd9f31d9912fa25f191c85a967f"
  },
  "skills": [
    {
      "name": "android-ci-setup",
      "ownership": "migrated",
      "source_path": "content/skills/android-ci-setup",
      "source_tree_sha256": "ee9713ac4fbc1d24a154b1d73b02fe5febeccd5a93d92ea014148eee74a00e97",
      "categories": [
        "android"
      ],
      "security": {
        "sensitive": true,
        "domains": [
          "ci-authority",
          "supply-chain",
          "release-credentials"
        ],
        "rationale": "Additional adversarial coverage is required for the listed sensitive surfaces."
      },
      "compatibility": {
        "standalone": true,
        "format": "Agent Skills",
        "codex_openai_yaml": false,
        "tuxedo": "optional"
      },
      "files": [
        {
          "path": "SKILL.md",
          "disposition": "preserved",
          "source_sha256": "80ec79ea41a6a4a1be9a64bdca350f710c8b2f3b5f6126c82b44f4bb1d176f1e",
          "destination_sha256": "80ec79ea41a6a4a1be9a64bdca350f710c8b2f3b5f6126c82b44f4bb1d176f1e"
        },
        {
          "path": "references/configuration-examples.md",
          "disposition": "preserved",
          "source_sha256": "988e6d1c19e5afe78e2162e8e8d8db283b0913d920ff2db515f4f9b04f18862a",
          "destination_sha256": "988e6d1c19e5afe78e2162e8e8d8db283b0913d920ff2db515f4f9b04f18862a"
        }
      ]
    },
    {
      "name": "chromadb-rag-workflow",
      "ownership": "migrated",
      "source_path": "content/skills/chromadb-rag-workflow",
      "source_tree_sha256": "7d9ff9984a3d148cdec050058eeb40f5b4c51a7910de0cc9ef78afa40cf3ae8f",
      "categories": [
        "data",
        "ai"
      ],
      "security": {
        "sensitive": true,
        "domains": [
          "database",
          "persistence",
          "tenancy"
        ],
        "rationale": "Additional adversarial coverage is required for the listed sensitive surfaces."
      },
      "compatibility": {
        "standalone": true,
        "format": "Agent Skills",
        "codex_openai_yaml": false,
        "tuxedo": "optional"
      },
      "files": [
        {
          "path": "SKILL.md",
          "disposition": "preserved",
          "source_sha256": "cdb8f95ea691e91a2a88670cb2c9a162ff6644b4d058411ed8eb645e79e2a087",
          "destination_sha256": "cdb8f95ea691e91a2a88670cb2c9a162ff6644b4d058411ed8eb645e79e2a087"
        }
      ]
    },
    {
      "name": "game-ai-2d",
      "ownership": "migrated",
      "source_path": "content/skills/game-ai-2d",
      "source_tree_sha256": "78c948f0d75e747204c7a1ece14a9ab9a62146fab8e93078b9eb588c0616a572",
      "categories": [
        "game-systems",
        "game-dev"
      ],
      "security": {
        "sensitive": false,
        "domains": [],
        "rationale": "Ordinary scoped writes remain protected by behavior-eval hashes and sentinels."
      },
      "compatibility": {
        "standalone": true,
        "format": "Agent Skills",
        "codex_openai_yaml": true,
        "tuxedo": "optional"
      },
      "files": [
        {
          "path": "SKILL.md",
          "disposition": "adapted",
          "source_sha256": "d317b2e5c0b9e516fff968fb5c607ca91b94099a5575782db5f5a078cacc077f",
          "destination_sha256": "48c215fb694daf85a55d0e6eff9237dffd962a96663cb4522e970bbed1e3a88c",
          "note": "Made companion specialized-skill composition explicitly optional."
        },
        {
          "path": "agents/openai.yaml",
          "disposition": "preserved",
          "source_sha256": "b3fdf2c3035221d396e87ee583be1d702df52832413d6b3af435fcb637d329ef",
          "destination_sha256": "b3fdf2c3035221d396e87ee583be1d702df52832413d6b3af435fcb637d329ef"
        },
        {
          "path": "references/ai-architecture.md",
          "disposition": "preserved",
          "source_sha256": "fbc840b8950345a4b5bfc9b16add9f609c814bd5ffbdaa4180ffb6c3202a3f3b",
          "destination_sha256": "fbc840b8950345a4b5bfc9b16add9f609c814bd5ffbdaa4180ffb6c3202a3f3b"
        },
        {
          "path": "references/godot.md",
          "disposition": "preserved",
          "source_sha256": "722f9e688b5d61723a288e4245d50118a78606ebefd41115a95e6a14231624c8",
          "destination_sha256": "722f9e688b5d61723a288e4245d50118a78606ebefd41115a95e6a14231624c8"
        },
        {
          "path": "references/phaser.md",
          "disposition": "preserved",
          "source_sha256": "3f53a75af7fb3f7a43e0e507371df1550ca1ffec145891df1210526d962d5b85",
          "destination_sha256": "3f53a75af7fb3f7a43e0e507371df1550ca1ffec145891df1210526d962d5b85"
        }
      ]
    },
    {
      "name": "game-art-2d",
      "ownership": "migrated",
      "source_path": "content/skills/game-art-2d",
      "source_tree_sha256": "70f1b4fdcc372e79f2851578a89441afcb1baacc67f7c1e395c65b2154e53754",
      "categories": [
        "game-art",
        "game-dev"
      ],
      "security": {
        "sensitive": true,
        "domains": [
          "filesystem",
          "image-generation"
        ],
        "rationale": "Additional adversarial coverage is required for the listed sensitive surfaces."
      },
      "compatibility": {
        "standalone": true,
        "format": "Agent Skills",
        "codex_openai_yaml": true,
        "tuxedo": "optional"
      },
      "files": [
        {
          "path": "SKILL.md",
          "disposition": "adapted",
          "source_sha256": "63f405c6521f6dc74b1885bc86762288f0dc5c3b9eb7f390e373c3979be9f2e4",
          "destination_sha256": "a6c21cf89cb577ccd6a0e4ca9b29c065b061f4c731a1468f91f33d845430f70b",
          "note": "Kept deliberate Codex image tooling while adding a standalone cross-client fallback."
        },
        {
          "path": "agents/openai.yaml",
          "disposition": "preserved",
          "source_sha256": "1cc3896a07d3c29d3da0dfe4e83c242859414b4563cce3f04b2c3ee9b225acc1",
          "destination_sha256": "1cc3896a07d3c29d3da0dfe4e83c242859414b4563cce3f04b2c3ee9b225acc1"
        },
        {
          "path": "references/animation-and-spritesheets.md",
          "disposition": "preserved",
          "source_sha256": "bbea9c12b127d4afe6dbeb7e5d16f7122389d286c9bb53e651c5e534d06792c1",
          "destination_sha256": "bbea9c12b127d4afe6dbeb7e5d16f7122389d286c9bb53e651c5e534d06792c1"
        },
        {
          "path": "references/art-direction.md",
          "disposition": "preserved",
          "source_sha256": "301ee60e2b3a9df3b63cd4163981372403315dead860b8fb60a0b7fdc3794132",
          "destination_sha256": "301ee60e2b3a9df3b63cd4163981372403315dead860b8fb60a0b7fdc3794132"
        },
        {
          "path": "references/characters-and-enemies.md",
          "disposition": "preserved",
          "source_sha256": "19be823c9586c6048de9945046cabb002186a72e6f576054a7ccac0127d7cd03",
          "destination_sha256": "19be823c9586c6048de9945046cabb002186a72e6f576054a7ccac0127d7cd03"
        },
        {
          "path": "references/godot/asset-pipeline.md",
          "disposition": "preserved",
          "source_sha256": "fda369a2b858364b7e01d46cd95fbc182a1cc6abff0177c942d729f98dd07c99",
          "destination_sha256": "fda369a2b858364b7e01d46cd95fbc182a1cc6abff0177c942d729f98dd07c99"
        },
        {
          "path": "references/items-props-vfx-and-ui.md",
          "disposition": "preserved",
          "source_sha256": "54113a4cb850e7d8eec2e3139b4c808a60b78d624549bc04b6d6be975eaf1abd",
          "destination_sha256": "54113a4cb850e7d8eec2e3139b4c808a60b78d624549bc04b6d6be975eaf1abd"
        },
        {
          "path": "references/maps-and-levels.md",
          "disposition": "preserved",
          "source_sha256": "8f5fbeb0f9037b7f78960d6791cbe9fa836d62ef22e4c852215779921e1c8036",
          "destination_sha256": "8f5fbeb0f9037b7f78960d6791cbe9fa836d62ef22e4c852215779921e1c8036"
        },
        {
          "path": "references/phaser/asset-pipeline.md",
          "disposition": "preserved",
          "source_sha256": "0d41b1d017e4b050382ad61ad3f63d7631ee32a223e8f094ce3172594bb352db",
          "destination_sha256": "0d41b1d017e4b050382ad61ad3f63d7631ee32a223e8f094ce3172594bb352db"
        },
        {
          "path": "references/pixel-art/style-guide.md",
          "disposition": "preserved",
          "source_sha256": "947f8024d778d750433250a5854c0a4bb70080cc11e8ea29076577692b9ac2f5",
          "destination_sha256": "947f8024d778d750433250a5854c0a4bb70080cc11e8ea29076577692b9ac2f5"
        },
        {
          "path": "references/pop-art/style-guide.md",
          "disposition": "preserved",
          "source_sha256": "edb27772e436f362aeb7efdf63917b2d7187baa97b3b80221933da529c5d8573",
          "destination_sha256": "edb27772e436f362aeb7efdf63917b2d7187baa97b3b80221933da529c5d8573"
        },
        {
          "path": "references/runtime-packaging-and-qa.md",
          "disposition": "preserved",
          "source_sha256": "60d46ad78d25e60508fa858c301ba66d6886004c7f32579279671292dad01a34",
          "destination_sha256": "60d46ad78d25e60508fa858c301ba66d6886004c7f32579279671292dad01a34"
        },
        {
          "path": "references/style-pack-contract.md",
          "disposition": "preserved",
          "source_sha256": "2c13a3f273c83a126d0da43ab4b0a51700d8cf733a88aa7cd2365794e1169aab",